{
  "username": "alice_smith",
  "email": "alice@example.com",
  "profile": {
    "firstName": "Alice",
    "lastName": "Smith",
    "bio": "Python developer passionate about clean code",
    "avatar": "https://example.com/avatars/alice.jpg"
  },
  "address": {
    "street": "123 Main Street",
    "city": "New York",
    "state": "NY",
    "zipcode": "10001",
    "country": "USA"
  },
  "preferences": {
    "theme": "dark",
    "notifications": true,
    "language": "en"
  },
  "tags": ["developer", "python", "pydantic"],
  "scores": [95, 87, 92],
  "active": true,
  "created_at": "2024-01-15T10:00:00Z"
}

